{
  "artifact_version": "1",
  "capability": "gold",
  "constituents": [
    "GOLD_SPINE products_total=112565 products_materialised=5966 below_min_reviews=106599 product_months=263792 active_product_months=129330 reviews_on_spine=360291",
    "GOLD_POINTS points=167518 evaluable=12109 condition_true=3167 alerts=425 evaluable_products=1145 unevaluable_baseline_reviews=150873 unevaluable_baseline_active_months=10 unevaluable_recent_reviews=4526 unevaluable_recent_active_months=0",
    "GOLD_EPISODES episodes=425 recovery=207 gap=165 end_of_data=53",
    "RUN_CONTRACTS gate=GOLD_GATE jobs=gold registered=1/1 missing=none run_contract_registered=true",
    "GOLD_GATE run_id=0cbdcc0d-a9e1-40e2-99c2-ad993c99b123 scope=full spine_complete=true reviews_on_spine=360291 silver_rows=694252 alerts_equal_episodes=true rule_status=frozen GOLD_GATE=PASS"
  ],
  "created_at": "2026-09-14T12:30:24+00:00",
  "gate_name": "GOLD_GATE",
  "kind": "reproducibility",
  "metric": {
    "direction": "eq",
    "name": "constituents_ok",
    "threshold": 4,
    "value": 4
  },
  "model": null,
  "phase": "P3 Gold",
  "pipeline_run_id": "0cbdcc0d-a9e1-40e2-99c2-ad993c99b123",
  "population": {
    "n": 263792,
    "name": "All_Beauty/gold.product_month",
    "products_materialised": 5966,
    "silver_rows": 694252
  },
  "prompt": null,
  "protocol_hash": "64d1ecb2a0e08481ebe806129718e473f308427b5a52609a0b8882888d187010",
  "scope": "full",
  "status": "PASS"
}
