{
  "artifact_version": "1",
  "capability": "themes_quality",
  "constituents": [
    "THEMES_THEME does_not_work        support= 28 tp= 19 fp= 34 fn=  9 p=0.358 r=0.679 f1=0.469 supported=true",
    "THEMES_THEME poor_build_quality   support= 21 tp= 12 fp= 13 fn=  9 p=0.480 r=0.571 f1=0.522 supported=true",
    "THEMES_THEME overpriced           support= 17 tp= 14 fp= 50 fn=  3 p=0.219 r=0.824 f1=0.346 supported=true",
    "THEMES_THEME wrong_size_or_fit    support=  8 tp=  3 fp= 32 fn=  5 p=0.086 r=0.375 f1=0.140 supported=false",
    "THEMES_THEME unpleasant_texture   support= 14 tp=  7 fp= 15 fn=  7 p=0.318 r=0.500 f1=0.389 supported=true",
    "THEMES_THEME hard_to_use          support= 18 tp= 14 fp= 26 fn=  4 p=0.350 r=0.778 f1=0.483 supported=true",
    "THEMES_THEME unpleasant_scent     support= 15 tp=  9 fp= 42 fn=  6 p=0.176 r=0.600 f1=0.273 supported=true",
    "THEMES_THEME not_as_described     support= 18 tp= 14 fp= 52 fn=  4 p=0.212 r=0.778 f1=0.333 supported=true",
    "THEMES_THEME irritation_or_harm   support= 15 tp=  7 fp=  3 fn=  8 p=0.700 r=0.467 f1=0.560 supported=true",
    "THEMES_THEME arrived_damaged      support= 11 tp=  9 fp=  4 fn=  2 p=0.692 r=0.818 f1=0.750 supported=true",
    "THEMES_SUBSET enriched reviews=120 macro_f1=0.4863 bootstrap95=[0.3701,0.5576] supported=9 failure_rate=0.2 (reported, not gated)",
    "THEMES_SUBSET representative reviews=80 macro_f1=NOT_RUN bootstrap95=withheld supported=0 failure_rate=0.0375 reason=\"no theme reaches min_support in the 80 prevalence-representative rows, so macro-F1 is undefined there and the interval beside it in the sealed artefact is an artefact of the resampler, not a result\"",
    "THEMES_COMPARISON set=audit llm=0.4583 [0.3647,0.5223] classifier=0.3899 [0.3074,0.4639] star_only=0.2968 [0.2612,0.3493] llm_vs_star=disjoint classifier_vs_star=overlapping development_llm_vs_star=overlapping",
    "THEMES_QUALITY macro_f1=0.4583 bar=0.7 bootstrap95=[0.3647,0.5223] min_supported_recall=0.4667 recall_bar=0.5 supported=9/10 reviews=200 failure_rate=0.135 scope=full blocks=false verdict=FAIL"
  ],
  "created_at": "2026-09-14T12:33:14+00:00",
  "gate_name": "THEMES_QUALITY",
  "kind": "quality",
  "metric": {
    "direction": "gte",
    "interval": [
      0.3647,
      0.5223
    ],
    "name": "macro_f1",
    "threshold": 0.7,
    "value": 0.4583
  },
  "model": "qwen3:8b",
  "notes": [
    "on the held-out audit set the labeller's interval [0.3647,0.5223] and the star-only floor's [0.2612,0.3493] are disjoint, so the labeller is distinguishably better than predicting themes off the star rating; on development the two overlapped, and the holdout reverses that earlier, smaller-sample reading rather than confirming it; the MLlib classifier's [0.3074,0.4639] does overlap the floor and is not distinguishable from it",
    "parse-failure census: failure_rate=0.135 (parse_failed=27 api_failed=0 absent=0 abstained=0 of 200); each failure scores as an empty prediction, so it is a recall loss that precedes any judgement about theme quality",
    "macro-F1 averages over 9 supported themes; wrong_size_or_fit falls below min_support 10 in the reference labels and is excluded from the headline, with counts printed",
    "representative stratum: NOT_RUN -- no theme reaches min_support in the 80 prevalence-representative rows, so macro-F1 is undefined there and the interval beside it in the sealed artefact is an artefact of the resampler, not a result"
  ],
  "phase": "P6 Themes",
  "pipeline_run_id": "e39584c3-9022-4417-8677-291166af7ec3",
  "population": {
    "enriched_rows": 120,
    "n": 200,
    "name": "audit (held-out, post-2020 candidate and control products)",
    "reference_source": "agent_reference",
    "representative_rows": 80
  },
  "prompt": "label-v5",
  "protocol_hash": "8a6d50fbc7fb896efaa5462e9d7c5cf6c51176a3d7cd0438f2f02af7f39d2566",
  "scope": "full",
  "status": "FAIL"
}
