{
  "artifact_version": "1",
  "capability": "gold_analytical",
  "constituents": [
    "GOLD_ANALYTICAL period=holdout eligible_products=502 alerted_products=139 share_of_eligible=0.2769 holdout_alerts=148 holdout_episodes=148 rule_status=frozen rule_config_hash=64d1ecb2a0e0 verdict=REPORTED"
  ],
  "created_at": "2026-09-14T12:30:24+00:00",
  "gate_name": "GOLD_ANALYTICAL",
  "kind": "quality",
  "metric": {
    "direction": "none",
    "name": "holdout_alerted_share_of_eligible",
    "threshold": null,
    "value": 0.2769
  },
  "model": null,
  "notes": [
    "decline rule frozen at decline_rule.toml; holdout starts 2020-01"
  ],
  "phase": "P3 Gold",
  "pipeline_run_id": "0cbdcc0d-a9e1-40e2-99c2-ad993c99b123",
  "population": {
    "holdout_evaluable": 4142,
    "holdout_points": 49113,
    "n": 502,
    "name": "holdout eligible products"
  },
  "prompt": null,
  "protocol_hash": "64d1ecb2a0e08481ebe806129718e473f308427b5a52609a0b8882888d187010",
  "scope": "full",
  "status": "REPORTED"
}
