{
  "artifact_version": "1",
  "capability": "demo",
  "constituents": [
    "DEMO_REHEARSAL 2026-09-14 cells=12 all_cells_ok=true elapsed_s=258 batches=50 rows=692252 replay_run=b5c2b752 commit=91133f46 backup_playable=true backup_missing=none counts=true",
    "DEMO_REHEARSAL 2026-09-14-2 cells=12 all_cells_ok=true elapsed_s=259 batches=50 rows=692252 replay_run=d0192a62 commit=4267ea2e backup_playable=true backup_missing=none counts=true",
    "DEMO_REHEARSAL 2026-09-14-3 cells=12 all_cells_ok=true elapsed_s=259 batches=50 rows=692252 replay_run=4c8a2df3 commit=4ccc4e4a backup_playable=true backup_missing=none counts=true",
    "DEMO_REHEARSAL 2026-09-14-4 cells=12 all_cells_ok=true elapsed_s=258 batches=49 rows=692252 replay_run=0e3528ac commit=4ccc4e4a backup_playable=true backup_missing=none counts=true",
    "DEMO_DOCS present=4/4 missing=none",
    "DEMO_GATE rehearsals=4/2 max_elapsed_s=259 all_cells_ok=true stream_running=true backup_playable=true docs_present=4/4 gate_scope=full DEMO_GATE=PASS"
  ],
  "created_at": "2026-09-14T13:25:49+00:00",
  "gate_name": "DEMO_GATE",
  "kind": "reproducibility",
  "metric": {
    "direction": "eq",
    "name": "constituents_ok",
    "threshold": 5,
    "value": 5
  },
  "model": null,
  "notes": [
    "a rehearsal is an executed export under docs/demo/<date>/, not a self-report: the cells' own recorded timestamps give the duration, move 10's DEMO_LIVE line gives the projection's batches, and a stream_produce ledger run overlapping those timestamps is the second, independent record that the stream was live"
  ],
  "phase": "Deliverables track",
  "pipeline_run_id": "0e3528ac-6048-47a9-8561-523c756115e6",
  "population": {
    "counted": 4,
    "n": 4,
    "name": "committed exports under demo/",
    "required": 2
  },
  "prompt": null,
  "protocol_hash": "41ace88dc714",
  "scope": "full",
  "status": "PASS"
}
