{
  "artifact_version": "1",
  "capability": "rag_quality",
  "constituents": [
    "RAG_QUALITY grounded=none/20 adequate=none/20 abstention=none/10 false_refusal=none/20 targets_met=0/4 judged=0/30 scope=full blocks=false verdict=NOT_RUN"
  ],
  "created_at": "2026-09-14T08:57:08+00:00",
  "cut_reason": "the thirty answers exist under RAG_GATE=PASS but Philip has not judged them; the four targets stay unmeasured until `make rag-judge-import` accepts all thirty judgement rows (ticket 13). The bars do not move while they wait",
  "gate_name": "RAG_QUALITY",
  "kind": "quality",
  "model": "qwen3:8b",
  "phase": "P7 RAG",
  "pipeline_run_id": "c4ae0dc5-58a5-47ec-96a7-093bac5fddfb",
  "population": {
    "annotator": null,
    "answerable": 20,
    "answers_run_id": "c4ae0dc5-58a5-47ec-96a7-093bac5fddfb",
    "n": 30,
    "name": "the thirty frozen P7 questions (20 answerable, 10 unanswerable in three strata), judged by Philip",
    "rubric_sha256": null,
    "unanswerable": 10
  },
  "prompt": "rag-v5",
  "protocol_hash": "fdaf85463c0fe877b39ff61810a4a3cdfc0e2f216f926a7ee856fba54a5886c1",
  "scope": "full",
  "status": "NOT_RUN"
}
