{
  "artifact_version": "1",
  "capability": "stream_control",
  "constituents": [
    "STREAM_SOURCE run_kind=control replay_run=b3413602 topic=reviews.stream records_acked=701528 sorted_file_sha256=3a532607ee9c replay_config_hash=4c8bccff40bd",
    "STREAM_VALIDATION function=src.spark.silver.parse_and_validate digest=3940f34067d6 silver_digest=3940f34067d6 shared=true",
    "STREAM_DEDUPE records_read=701528 ledger_records_read=701528 rows_valid=701528 rows_rejected=0 unique_review_ids=694252 duplicates_dropped=7276 expected_from_sort=7276 sort_run=756fb1f2",
    "STREAM_WATERMARK delay=30 days natural_drops=0 source_order=event_time_sorted ingested_at=2026-09-14T09:46:07.224931+00:00",
    "STREAM_SURVIVOR silver_run=4447727f collision_groups=6139 exact=6138 conflicting=1 unresolvable=0 stream_rule=first_arrival batch_rule=helpful_vote,text_length,canonical_hash",
    "STREAM_RECONCILE gold_run=6e1c0d3a product_months_compared=193939 differing=0 only_in_stream=0 only_in_gold=0 only_in_stream_unmaterialised=210541 columns=review_count,rating_sum,neg_count,verified_count,verified_rating_sum,nonempty_text_count,long_text_count not_projected=distinct_users",
    "RUN_CONTRACTS gate=STREAM_GATE jobs=sort_replay,stream_produce,stream_aggregate registered=3/3 missing=none run_contract_registered=true",
    "STREAM_GATE run_kind=control run_id=74dde108-676a-49cf-a2a9-b3c6a8263bae scope=full natural_drops=0 differing_product_months=0 failed=none STREAM_GATE=PASS"
  ],
  "created_at": "2026-09-14T09:51:52+00:00",
  "gate_name": "STREAM_GATE",
  "kind": "reproducibility",
  "metric": {
    "direction": "eq",
    "name": "constituents_ok",
    "threshold": 11,
    "value": 11
  },
  "model": null,
  "notes": [
    "reconciled against lake.gold.product_month@2967561192178189477 (gold run 6e1c0d3a)",
    "watermark 30 days, 16 micro-batch(es)",
    "distinct_users is not projected: a distinct count cannot be summed across micro-batch contributions"
  ],
  "phase": "P8 Stream",
  "pipeline_run_id": "74dde108-676a-49cf-a2a9-b3c6a8263bae",
  "population": {
    "gold_run_id": "6e1c0d3a-85e8-4458-8109-57b76331ad38",
    "n": 193939,
    "name": "All_Beauty/stream.product_month vs gold.product_month",
    "records_read": 701528,
    "replay_run_id": "b3413602-4b1b-499d-9aee-a35f535b0fcd",
    "unique_review_ids": 694252
  },
  "prompt": null,
  "protocol_hash": "4c8bccff40bd7c6374c95a4e376ecaaf8278b29993669580ed8471e04e6605db",
  "scope": "full",
  "status": "PASS"
}
